{
  "schema_version": "0.1.0",
  "event_id": "01J7AUTHEVENT000001",
  "session_id": "01J7AUTHSESSION0001",
  "sequence": 12,
  "occurred_at": "2026-09-07T03:11:40Z",
  "received_at": "2026-09-07T03:11:41Z",
  "source": {
    "type": "burp",
    "instance_id": "01J7BURPINSTANCE001"
  },
  "scope": {
    "status": "in_scope"
  },
  "payload": {
    "type": "http.response",
    "data": {
      "method": "GET",
      "path": "/api/orders/1001",
      "status": 200
    }
  },
  "artifact_refs": ["01J7AUTHARTIFACT001"],
  "privacy": {
    "redaction_status": "sanitized"
  }
}
